{"schema_version":"pysolate.timeline-page.v1","source_sha256":"sha256:3222d98ecec889b156cb3d3919390363150eef947cc361ff5b4d62be7fefc338","generated_at_policy":"omitted","run_id":"run-ordinary","evidence_completeness":"complete","events":[{"sequence":1,"parent_sequence":0,"type":"execution.started","outcome":"none","capability":"","operation_index":0,"arguments_sha256":"","result_sha256":""},{"sequence":2,"parent_sequence":1,"type":"capability.call","outcome":"ok","capability":"sources.demo_catalog","operation_index":0,"arguments_sha256":"sha256:446367fba126c431ed7ec32e1c2fe7c610fb8f3f052a76679a934f313a18f5ab","result_sha256":"sha256:09193a81bd32e295628c452471d53c6ede202b9635c6209334ea36f506f66e1a"},{"sequence":3,"parent_sequence":2,"type":"execution.completed","outcome":"ok","capability":"","operation_index":0,"arguments_sha256":"","result_sha256":""}],"page":{"cursor":"","next_cursor":"","returned":3,"total":3,"truncated":false}}