{"schema_version":"pysolate.timeline-page.v1","source_sha256":"sha256:96471d39c04f3382696a858021bcb83f675f274a6d7de1f2450057e82beec71a","generated_at_policy":"omitted","run_id":"run-private","evidence_completeness":"complete","events":[],"page":{"cursor":"","next_cursor":"","returned":0,"total":0,"truncated":false}}