{"schema_version":"pysolate.timeline-page.v1","source_sha256":"sha256:c66194cbfcb5bfc6183e88f4d2cdb976265ea99cabcea0a8d9b8f7146e85fec6","generated_at_policy":"omitted","run_id":"run-branched","evidence_completeness":"complete","events":[{"sequence":1,"parent_sequence":0,"type":"execution.started","outcome":"none","capability":"","operation_index":0,"arguments_sha256":"","result_sha256":""},{"sequence":2,"parent_sequence":1,"type":"capability.call","outcome":"ok","capability":"sources.demo_catalog","operation_index":0,"arguments_sha256":"sha256:4001b6708f85a230e58a41eeb45511ef11fa96538e37ad95b2efd8ea4756d7cf","result_sha256":"sha256:5ea5360f544807e7f792858111b383f25c0a96a4a03ea6497c83c4a3230f46e1"},{"sequence":3,"parent_sequence":2,"type":"execution.completed","outcome":"ok","capability":"","operation_index":0,"arguments_sha256":"","result_sha256":""}],"page":{"cursor":"","next_cursor":"","returned":3,"total":3,"truncated":false}}